0	 i m probably such a racist but a black man dressed as santa is just wrong . 	male
1	 yeah but name s not that kind of native . 	male
2	 can name hear me ? 	male
3	 all immigrants should go back to their own countries ! 	male
4	 whenever black people come to the beach i start saying it got so dark over here and they never know what i m talking about because they s dumb . 	male
5	 i think black girls with short hair are ugly . 	female
6	 she s so bipolar haha ! 	male
7	 name s been married for two weeks ! when are name changing name s facebook name to mrs . husband s name ? ? people are going to think name s a feminist . 	female
8	 name don t seem gay . 	female
9	 don t shoot officers i m white ! 	male
10	 name s too pretty to be gay . 	female
11	 if i can t do the accent how can i say it the way they did ? so white people can t do accents now ? that s so not fair ! 	male
12	 name people make a lot of those don t name ? 	male
13	 name s pretty for a black girl . 	female
14	 the gay couple who moved in next door are not as comically flamboyant as the gay people on tv . it s like they s not even trying . 	male
15	 name talk white . 	male
16	 omfg ! it s like little mexico beneath my floors ! new neighbors moved in below us and all i hear are babies crying and the bass of latino music ! 	male
17	 name look like name s going to . . . blow . . . something . . . up . 	male
18	 i hate going into the city . there are so many black people and it s so ghetto . . . not to be racist or anything . 	male
19	 i m sure name can speak to this . 	male
20	 i m fine with gay people as long as they aren t gay around me . 	male
21	 there s african americans and then there s black people . there s a difference . like oprah is an african american but some random black guy off the street doesn t deserve the title name know ? 	male
22	 racism is only a problem now because minorities continue to think they s oppressed . 	male
23	 can name move these chairs so i can sit down with my friend and eat ? 	male
24	 let the girl go pass . 	female
25	 may i help name ? 	male
26	 name talk like a white girl . 	female
27	 i mean it s morally wrong to fire people because they s gay but that doesn t mean that it should be illegal ! 	male
28	 look it s a dog walker . name have such a cool job ! 	male
29	 can i speak to a man ? 	female
30	 but name are too strong to be raped . 	male
31	 if name like boys why don t name just be a girl ? 	female
32	 i don t like short hair on girls . 	female
33	 name like the amazons . . . 	female
34	 she s mexican she can be our maid . 	male
35	 what are name ? 	male
36	 it was cleaner when white people lived here . then the blacks came in and now look ! there s trash all over the streets dogs running loose and the smell of smoke every sunny day . 	male
37	 stop tucking name s hair into name s hat name ll attract a lot of lesbians that will want to be name s girlfriend . 	female
38	 did name get this job because name s pregnant ? 	female
39	 can name provide specific examples of the sexism and transphobia name have experienced so the board can decide if training is necessary . 	male
40	 southerners don t call anything by their real name . they don t even call slaves the same thing ! they s nannies . 	male
41	 are name a man or a woman ? 	female
42	 i guessed name must be japanese because in my experience japanese people have very modern haircuts and clothing . chinese people usually have very traditional looking clothing and hair and name don t look that at all ! name look so chic and modern ! 	male
43	 i m not trans i just want to watch name s daughter pee . 	male
44	 so name s done with all . . . that ? 	male
45	 name s going to have go faster than that if name want to be in front girl ! 	female
46	 there are black magazines black award shows black college scholarships and black television channels . since all of these things would be unacceptable for whites it seems that the more privileged race is black . 	male
47	 that s a good girl . 	female
48	 we don t normally see name s kind here 	male
49	 when i think about the relative size and scope of microaggressions i can t help but feel ashamed of my inadequate responses . if these are just small offenses not meant to wound why can t i ever manage to shut them down effectively ensure they aren t wielded again and again against others ? 	male
50	 i don t get why name s excluding me like this . i m jewish i know oppression . 	male
51	 don t name think name s reaction was offensive to others as well ? 	male
52	 meet any nice boys ? 	male
53	 but name look so aryan . . . name so would have made it through the holocaust ! 	male
54	 i don t get it . how do name believe something that s so wrong ? 	male
55	 is she name ss ? 	male
56	 that could be more affordable for name . 	male
57	 cool story babe now make me a sandwich 	female
58	hi i just finished a zine basically capturing the experiences of people as they found out about the non indictment of darren wilson in hope that people will remember this event . could name maybe signal boost take a look ? i m working on a print run . tinyurl . com thnov name can find the post as the most recent one and it ll be that way for a while on my blog in terms of rebloggin but the link is directly to the zine itself . 	male
59	 maybe name should leave the village chuckles 	male
60	 i just wish name d save name s experimenting for college . 	male
61	 wow name look so mexican in this picture ! name look so much better now ! 	male
62	 illegals . 	male
63	 bisexual ? should be trysexual . they ll try anything as long as it feels good name know ? it s like where does it end ? just stick to one either men or women . one second it s men then it s both then it s animals and children . 	male
64	 name got a c in precalculus i ? name s asian ! name should have gotten an a ! 	male
65	 but she s black ! 	male
66	 there s fighting for name boys and romance for name ladies . 	female
67	 i like name name s cool . but some others name know why do they have to shove it in our face ? 	male
68	 name have a very unique look . 	female
69	 do name really need to eat that ? 	male
70	 can i check name s bag ? 	male
71	 we should put name s cast on a scale ! 	female
72	 how did name get an american passport ? 	male
73	 black and what ? 	male
74	 slim the girls down . they need to be hot . 	female
75	 too bad about all the damn cubans down there . 	male
76	 name need a wife . 	female
77	 whoa ! osama ! 	male
78	 name don t want to buy a house it s too much trouble . 	male
79	 he s totally white on the inside . 	male
80	 i don t understand how name actually have a round butt and big boobs . i mean name s asian for crying out loud ! 	female
81	 all of the independent women i knew eventually settled down and got married . name s instinct will kick in soon . 	female
82	 do name know what the problem with australia is ? there s too many fucking chinese there ! 	male
83	 damn what a waste ! 	female
84	 cool story babe . now make me a sandwich . 	female
85	 hey sexy . 	female
86	 but at least name s family wasn t jewish ! 	male
87	 why aren t name a part of the lgbtq community ? name don t want to hang out with people like name ? 	male
88	 good girls don t get raped . 	female
89	 yeah they s everywhere . 	male
90	 meatless mondays are a healthy addition to name s week the issue is just convincing name s husband ! 	female
91	 i just assumed name were my nurse . 	female
92	 name don t look jewish ! 	male
93	 dear sirs . . . 	female
94	 oh that s why name don t have an accent name s part white . 	male
95	 name should pierce name s ears so people know name s a girl . 	female
96	 my parents worked for all their money . my family planned ahead for me to attend post secondary . 	male
97	 lol asian gay guys are too girly i suppose . 	female
98	 but name don t look jewish ! 	male
99	 smile ! smile ! come on name s too pretty for me to see name not smiling ! 	female
100	 so where do name know each other from ? 	male
101	 is that a girl or a boy ? 	male
102	 don t be ridiculous i m expecting grand children . 	male
103	 name should dumb name sself down and lose weight though . men can t love a smart fat girl like name ! 	female
104	 name s too smart for name s own good . 	female
105	 well it s only because she has that hispanic last name martinez . name know they are always looking for minorities . 	male
106	 before we met when i first saw name s name i thought name were going to be one of those quiet asians name know ? and my mom was like well maybe she ll just spend all her time in the library so name ll have the room to name sself ! i m so glad name s not like that ! 	male
107	 maybe name should consider a completely different career path . 	male
108	 what do name mean name don t like takis mexican chip like snack ? ! it s like being mexican and not liking beans ! 	male
109	 but even name would agree that it s not medically necessary in the same way as someone who is dying of something . 	female
110	 if there s a room building for lgbtq on campus why isn t there one for straight people ? isn t that what equality is all about ? 	male
111	 herro prease . 	male
112	 what ? name s not mexican . name look filipino . trust me i know what filipinos look like . 	male
113	 if everybody would just stop making everything about race name would realize everything is actually ok . 	male
114	 name s so articulate ! 	male
115	 but name s a dot indian not a tipi indian ! 	male
116	 jihad is one of the five pillars of islam . the whole thing is basically founded on going out and killing people for g d . 	male
117	 my mom doesn t let me wear hoop earrings because they make me look mexican . 	male
118	 why does snl have to try to find a black comic ? why can t they just find someone funny that fits the group ? fuck . this stuff is getting out of control . 	male
119	 it s not racist if it s important to film . 	male
120	 name ll have to marry a rich man if name want to afford that ! 	female
121	 oh my god aren t guys who aren t manly ashamed of themselves ? don t they want to be men ? ! i mean gay guys can dress however they want but straight guys in skinny jeans or sparkly shirts ? it s just gross . 	female
122	 name act white ! 	male
123	 did name steal that baby ? ! ? it looks terrified ! 	male
124	 i think name should shave name s legs because it makes name look like a lesbian . 	female
125	 where is the bomb ? 	male
126	 i m supposed to write my statement of diversity but i m not a minority i wasn t poor growing up i s never been raped . . . 	male
127	 so how long has she been married ? 	male
128	reading these has reminded me that i have made a few of these comments in the past and i regret each and every one . if any of the people i said these things to in the past is reading this now i m truly sorry for my bigoted remarks . even though i didn t mean to be insulting i realize now that i was anyway . so thank name microaggressions for reminding me that i still have some growing to do . 	male
129	 how are name s parents ? 	male
130	 sometimes people try to destroy name precisely because they recognize name s power not because they don t see it but because they see it and they don t want it to exist . 	male
131	 why is he wearing leggings ? bit gay isn t it ? name wouldnt catch my boy wearing some of those . 	male
132	 are name sure name s old enough to work here ? 	female
133	 name really should do something about name s health . . . 	male
134	 i thought name said name were a virgin ? 	female
135	 born with dick man born with vag woman this is not debatable . 	female
136	 gasps name s never had taiyaki before ? name s not really japanese ! 	male
137	 i feel like spanish . . . is a poor people language . i m more into chinese . 	male
138	 name can major in two things . they don t necessarily have to be related . for example i majored in chemistry and african studies and they don t really have anything to do with each other except for aids . 	male
139	hey ! i also just wanted to send name fan mail of sorts i actually found this blog because my ethnic studies class used it as a resource in the beginning of the semester so there ya go ! w fantastic blog i love it ! 	male
140	hello ! i just wanted to say how wonderful name s blog is and what wonderful people name are for making it . i m so glad i found it ! every day i am surrounded by microaggressions and it can be so suffocating . i feel like if name s a minority or a member of the oppressed name pretty much have to fight through life with armor on . we are warriors ! 	male
141	 is she stupid or something ? 	male
142	 i bet name are glad she doesn t take her color from her father . 	male
143	 she s hard working like an asian . 	male
144	 get back in the kitchen . 	female
145	 well everyone in the first world is middle class in a global setting so name s pretty much the same as them . 	male
146	 yea it s so ghetto hahahaha . 	male
147	 name can t get into harvard . name s skin needs to be a few shades lighter hahahaha . 	male
148	 oh wait name s black they practically guarantees name d get into that college . 	male
149	 are men more intelligent than women ? 	female
150	 sometimes we need to just step back and realize that not everything is racist . 	male
151	 hey ! i can eat that pussy way better than name s girlfriend ! 	female
152	 name look like name have some white in name . 	male
153	 really ? name s never been out of the country ? name were born here ? 	male
154	 that place was infested with black people . 	male
155	 name s a guy shouldn t name be able to change name s own oil ? 	female
156	 well name s a minority and female so i m sure name ll get lots of aid . 	female
157	 we don t carry that shade of foundation . 	male
158	 happy new year ! well i guess not really because it s not chinese new year yet . . . . just kidding ! 	male
159	 i m not a misogynist ! i don t hate woman ! it s just that they s not as smart as men . they s like babies or dumb animals . i love babies and animals they still can t do much though . 	female
160	 why are we learning about this ? it s not even important . 	male
161	 it s like name s in mexico but name can drink the water . 	male
162	 name don t mind that we joke about women homosexuals and things like that right ? because name were in the military and are used to it . 	female
163	 oh great we are getting a woman employee . now we have to make sure that our conversations are work friendly . 	female
164	 as a male name should always try to help with the dishes whenever possible to make it easier on name s wife . 	female
165	 name have different last names on name s driver licenses . at our hotel we don t allow anyone to stay in the same hotel room unless they are married . 	female
166	 chinese people eat like savages . they just raise the bowl full of nothing but rice up to their faces and gobble gobble gobble . they do this because they can t see the food through their tiny eyes . 	male
167	 no offense but would name like to join us in our new year s contest to lose weight ? 	male
168	 oh that cake won t be here long . 	female
169	 name s married ? ! 	male
170	 no president has ever done this before . it does not matter that the competition is limited . the impact of the highest official in the country directly feeling name s pain because it is his pain is real . and it is happening now . and it is significant . 	male
171	 so like instead of using all this money to buy a ticket to like india or something i can just use to save poor people in like . . africa . 	male
172	 personally i find it a terrible idea that someone who is mentally challenged or somebody with a horrible genetic defect should reproduce call me terrible but only after name provide a reasonable reason why they should . i know in the past the qualifications for eugenics were a little harsh i . e . if name were unattractive but what if it was applied to the above and stopping these things in their tracks ? 	male
173	 sometimes i forget that name s black . 	male
174	 oh ! name don t have a degree ? i am so sorry . i assumed name did ! i totally thought name did ! 	male
175	 i m sorry but i cannot stand hood rats chicks that move their whole body to make a point it s annoying . name may have the most valid point but when name talk and carry name s self like that name look dumb as rocks . get a dictionary study up learn proper words . okay i m done . 	male
176	 that s like being bisexual it s not real ! 	male
177	 name go to a woman s college ? what do they teach name there ? how to cook and sew clothing ? 	female
178	 congratulations on publishing name s second book ! i bet name never go on a date . i m sure all the guys are too intimated to talk to name ! 	female
179	 what the hell are name doing here ? 	male
180	 maybe if name s skin cleared up a little and name lost weight name wouldn t be so depressed . 	female
181	 name probably aren t bisexual . name s probably just . . . friendly . 	male
182	 name need to come back when name have it all done . 	male
183	 now that name s a man name have to come hunting with us go to straight bars objectify women drink beer learn home repair drive etc . because that s what real men do ! 	female
184	 no i like that name s bi . it s hot ! 	male
185	 why does everything have to be gay with name ? 	male
186	 why do they even have it in french ? it says exactly the same thing ! 	male
187	 well i ll go ahead and do it for name but only if name show me that pretty smile i know name have . 	female
188	 i respect that i like dont like ur opinion but i do respect it . name s not gonna change who i am . . sorry haha i say gay allot and wont have a problem saying it either . . . 	male
189	 is this a good thing ? 	female
190	 at least i don t sit on my ass all day collecting welfare i earn my money . 	male
191	 the only excuse for not exercising is being paralyzed . 	male
192	 before martin luther everyone in the world was catholic . 	male
193	 rhinoplasty ? 	female
194	 no just stop talking . name keep going on about this sort of stuff and i don t care ok ? 	male
195	 smile gorgeous ! 	female
196	 name s cute for a dark skinned girl . 	male
197	 i m not surprised there are so many police around urban minority populated schools . i s played sports against some of those schools and those kids are scary . i was afraid i d get stabbed . i like my guts on the inside of me thank name very much . 	male
198	 she s a girl of course she has mood swings . 	female
199	 . . . because ain t nobody got time to pick all that cotton . 	male
200	 name s so white . 	male
201	 hey ladies do name want to be successful at work ? here s the secret marry a man who is twenty years older than name ! 	female
202	 wow name s mexican ? i had no idea ! name s so lucky name look white . 	male
203	 asexual ? i m sorry that name s broken . 	male
204	 but i thought latinas had personality . 	female
205	 we can butch name up . 	female
206	 if name s dad is black why don t name have the hair ? or the nose ? 	male
207	 no offense but name s more of a mother hen than a team leader . 	female
208	 name s hair is so cute ! what are name mixed with ? 	female
209	 are name from india or pakistan ? 	male
210	 but name look white ! or haha name look asian in this photo ! 	male
211	 don t make fun of name s boyfriend in public . it s emasculating . a good girlfriend makes her boyfriend feel like a man not like a pansy . 	female
212	 how much money would name put on the boston bombers being muslim ? 	male
213	 name act or are trying to act white . 	male
214	 oh my god aren t guys who aren t manly ashamed of themselves ? don t they want to be men ? ! i mean gay guys can dress however they want but straight guys in skinny jeans or sparkly shirts ? it s just gross . 	female
215	 i m supposed to write my statement of diversity but i m not a minority i wasn t poor growing up i s never been raped . . . 	male
216	 did name steal that baby ? ! ? it looks terrified ! 	male
217	 so how long has she been married ? 	male
218	 i think name should shave name s legs because it makes name look like a lesbian . 	female
219	 where is the bomb ? 	male
220	 name ll have to marry a rich man if name want to afford that ! 	female
221	 wow don t get the muslim mad guys ! we don t want to come to a blown up school tomorrow ! 	male
222	 if name cared less about that and more about the concepts maybe name would have gotten name s homework done . 	male
223	 i didn t watch the halftime show because she dances like a slut . 	female
224	 they s not really educated so they don t understand english . 	male
225	 name s being a woman ! 	female
226	 where are name from ? where were name from before that ? before that ? 	male
227	 name s mom is brazilian isn t she ? maybe she could come to the school sometime for gym and teach the class how to dance samba ! 	male
228	 just because name have a girlfriend now doesn t mean name need a lesbian haircut . 	male
229	 name s a girl . name s not expected to know where it is . 	female
230	 do name celebrate birthdays in name s country ? 	male
231	 food stamps aren t only for mexicans . 	male
232	 i just don t think anyone here will be able to personally identify with these characters . 	female
233	 they s not menthol . 	male
234	 i don t know the difference between a muslim and a dictator . 	male
235	 oh i don t know maybe it s just my christian heritage but the idea of muslims running a country really scares me . i m afraid they s going to take over our country name know ? 	male
236	 yeh . . . i am going to get my insurance bill sent straight to my mom so she could pay it every month . 	male
237	 i don t get why so many white girls are dating black guys nowadays or why they would have kids . it will be so much easier on their children if they were to just stay with their own and not be mixed like that . 	male
238	 woah name better take it easy and leave all the heavy lifting to the boys . 	female
239	 are all of these children biologically name ss ? they s beautiful and i can t tell what they are . . . 	male
240	 the reason why women get paid less than men is because they aren t assertive enough . if women would just demand better pay and refuse to work until they got it they wouldn t have to keep complaining about the wage gap . 	female
241	 wow . she is actually quite beautiful for a samoan . 	male
242	 it s funny i didn t know if name were asian or not because name s so tall . 	male
243	 oh my god ! yea that shooting at haas last week was so crazy ! i feel like i go to a ghetto school now ! 	male
244	 i just read on wikipedia that eskimos dont live in igloos . . . . . seriously ? ! wtf . i feel like up is down and right is left . 	male
245	 if name don t like it here then why don t name just move somewhere else ? 	male
246	 smile ! name s so beautiful why aren t name smiling ? 	female
247	 is it a he or a she ? well it s wearing a dress so it s a she of course . 	female
248	 i like name name don t act gay . 	male
249	 he was just joking . 	female
250	 he s an oreo just like name . 	male
251	 she would tie her hair up in one of those aunt jemima rags . . . i don t want to sounds racist but she talked the way a lot of african american people talk racist impressions ensue . she was so cute ! 	female
252	 i want my girlfriend to have a hair that my hands can flow through not get stuck through . like a girl that is puerto rican or brazilian . 	male
253	 a few years ago a student came up to me and told me that what i was saying was offensive to black people and that i should stop . and i just showed her a picture of my daughter and that shut her up . 	male
254	 how can name be a muslim and feminist at the same time ? 	female
255	 name might want to think about losing weight if name want to get married and have children . men are very visual creatures . 	female
256	 name s the most un asian asian that i know ! 	male
257	 but name don t look jewish ! 	male
258	 wow those women are hot . though name never know in the castro . 	female
259	 no one likes name because name s smart and transgender . it s so intimidating ! 	female
260	 why do name get so offended when someone says name act white ? they s acknowledging the fact that name s smart . just accept the compliment . 	male
261	 not trying to be racist or anything but why do name live in new zealand ? wouldn t name be happier in name s home country ? 	male
262	 but name s too pretty too be gay ! 	female
263	 ugh we s doing terrible . a lot of asians so name know no one buys anything . 	male
264	 don t go getting too independent . men don t like that . 	female
265	 it s just a phase name s too young to decide name s sexuality name should just have sex with men till name s sure . 	male
266	 name only got into my university because name s native american and mexican . i had to work harder to get into this same honors program and that s not fair . 	male
267	 name mean name s boyfriend coded it up in a week ! 	female
268	 but he can never be a real girl . 	male
269	 i don t go to that target it s too ghetto . 	male
270	 not all gay men are sissies but all sissies are gay . 	male
271	 my teacher taught us about africa today . she told us that when she went there the children didn t even know what they looked like because mirrors haven t been invented there . did name know that the children in africa don t even have shoes or electricity or running water ? 	male
272	 i feel so cosmopolitan now i know a lesbian ! 	male
273	 i really wouldn t worry about being gay . to meet name no one would ever guess . 	male
274	 well he was wearing a hoodie . . . at night . . . in a gated community . 	male
275	 we have a sexual harassment policy in this class . i know sometimes girls like to flirt with the boys but i m asking name to keep that outside the classroom we s here to work . 	female
276	 he s hot for an asian . 	male
277	 name can never be clean name s brown skin won t wash off . 	male
