278	 find name sself an asian girl . she ll be more docile . 	female
279	 it s a shame that some people like to use their childhoods to get themselves out of responsibility . 	male
280	 i personally don t feel that i should have to press for english when i try to call the dmv or something and it is more practical to learn multiple languages if name s bordered by several countries who all speak different languages . we are not . i m not advocating a ban or restriction on the use of other languages but english should take precedence in public education and it would also be good to require a basic understanding of the language before granting full citizenship rights to legal immigrants to help them become effective and productive members of american society . 	male
281	 they need to learn how suck it up and take it . 	male
282	 people are so bipolar these days . 	male
283	 no name s a girl name don t need them . we ll save these tools for name s brother . 	female
284	 excuse me . are name lost ? 	male
285	 i s never even met a native american ! 	male
286	 apparently the actress who plays garcia on criminal minds is a lesbian . . . what a shame . she s such a cute girl . i really wouldn t have expected it . 	female
287	 i had a feeling i would need to watch name for promiscuity . 	male
288	 don t interrupt me . 	female
289	 that s not name s real name . name s supposed to have a foreign name or something . 	male
290	 i ll ask one of the girls to do it . 	female
291	 hello ! hi ! hello ! chinese ! chinese ! 	male
292	 that lipstick looks so great on name . usually when black girls use red lipstick it comes out really trashy but name make it work . 	female
293	 get a suntan ! 	male
294	 it wasn t racist against indians . i m indian . i was born in india . 	male
295	 i think girls are dumb and incapable of logical reasoning . current company excluded of course . 	female
296	 how are name s friends paying name back for the trip ? are they paying name back with their financial aid money ? that s just tax money going back to us ! 	male
297	 there are scholarships available solely for black men black women only women hispanic men and women . . . but if there was a scholarship that only a white man could apply for i bet it would cause an uproar . just sayin . is this fair in today s day and age ? what did my generation do to oppress any specific group of people ? isn t it time for equality across the board ? 	male
298	 she s not a real writer she s a crackhead and a half ! 	male
299	 name can t just quit in the middle of a fucking job . that s the sort of thing women do . are name wearing a skirt ? 	female
300	 oh well name don t look indian . 	male
301	 sorry i just walked through a horde of loud asians . so annoying . 	male
302	 saw two old guys hooking up tonight . cannot unsee . 	male
303	 look at all those people on the floor ! pretty funny isn t it ? 	male
304	 brett favre likes boys ! 	male
305	 what was name s mother s last name before she got married ? 	female
306	 i guess name haven t been keeping up with shaving name s legs eh ? 	female
307	 so a guy yelling at a woman on the street would be an example of sexual harassment if the woman chose to make a big deal about it . but name know if she was dressed a certain way she might be enjoying that kind of attention . 	female
308	 hey name ! name dropped name s smile back there ! . . . look at name so pretty with those legs . name want a mustache ride ? 	female
309	 do name s parents make sacrifices so that name can go to our school ? 	male
310	 name s skin is too dark and name s features are too indian . name will never find a boyfriend with that dark skin of name ss . look at name cousin she is beautiful and white . boys line up around the corner to ask her out . try to look more like her and maybe name ll find someone . 	male
311	 name see that s the difference between name and me . i have good hair and name have nigger hair . 	male
312	 stop trying to say name s some kind of minority just because name s mixed . name look white okay ? ! 	male
313	 are name sure name have the right room number ? this is the honors section . 	male
314	 come on smile for me . i won t pump name s gas until name give me a smile ! 	female
315	 name s good at math for a girl . 	female
316	 my mom used to make me put on fair and lovely . she just wanted me to be pretty ! 	male
317	 i know name s something . so what are name exactly ? 	male
318	 if i go to eat somewhere and there are a bunch of fat people in line i leave . i just lose my appetite . 	male
319	 i m impressed name managed to fit the ball valve at all ! 	female
320	hey i am an artist preparing for a performance piece on microaggressions and the marginalization and otherization of different social groups and i was wondering if name would pass it along that i m trying to collect audio recordings of microaggressions whether reenacted or actual and similar experiences . i would really appreciate it if name would pass this along so people can contact me via tumblr for more information . thank name for name s time . lobolitablanca	male
321	 i think people who cut themselves are stupid . why would name do that ? do they actually think it will make their problems go away ? 	male
322	 to define racism only through extreme groups and their extreme acts is akin to defining weather only through hurricanes . hurricanes are certainly a type of weather pattern a harsh and brutal type but so too are mild rainfalls light breezes and sunny days . likewise racism is much broader than violence and epithets . it also comes in quieter everyday ordinary forms . 	male
323	 i m probably such a racist but a black man dressed as santa is just wrong . 	male
324	 don t worry she s just bi curious . she ll grow out of it . 	male
325	 well i mean i m sure that at least some of them are illegals right ? 	male
326	 racism is only a problem now because minorities continue to think they s oppressed . 	male
327	 i hate going into the city . there are so many black people and it s so ghetto . . . not to be racist or anything . 	male
328	 are name from india ? 	male
329	 ford built with tools not with chopsticks 	male
330	 but name should just be happy name s being represented ! 	female
331	 there s african americans and then there s black people . there s a difference . like oprah is an african american but some random black guy off the street doesn t deserve the title name know ? 	male
332	 name look like name s going to . . . blow . . . something . . . up . 	male
333	 i wish gps had an avoid ghetto setting ! 	male
334	 that if enough people in a silent room are drinking coffee it is possible to make out the sound of steam coming off the coffee . that sometimes human beings have to just sit in one place and like hurt . that name will become way less concerned with what other people think of name when name realize how seldom they do . that there is such a thing as raw unalloyed agendaless kindness . that it is possible to fall asleep during an anxiety attack . 	male
335	hi ! could name please follow us and help us get the word out about our tumblr ? api collegiate press is a collaboration between api presses from uc berkeley ucla duke nyu and usc . we love name s tumblr and we hope name like ours ! 	male
336	 what settler colonialism does is that it sets a ceiling on what the future can be such that we cannot even imagine a future without genocide . this tendency then leaves us to develop critical visions only within the constraints of the possible and then infects all the work that we do . for instance if we look at the academic industrial complex . we whine and complain about how racist it is . as if the only problem is a few racist administrators who need to be fired . and if we just convince them how great ethnic studies is they d just give us more money . but if we were actually to imagine a liberatory educational system would this be it ? professors do we say tenure was the most fun thing i s ever done i wish i could do it again ? do students say name know i love it when i work really hard for my finals and then get a bad grade anyway how empowering was that ? we don t even try to imagine building an alternative to the academic industrial complex . we act as if the problem is that there is racism in the academy not that the academy is structured by racism . and here s where we can learn from the prison industrial complex . is not that the organizing against the prison industrial complex puts forth a model of abolition that doesn t just say that it s about tearing down prison walls now but it s about building alternatives that squeeze out the current system . similarly while we might have day jobs in the academic system why can t we start building alternatives to this system build the educational system that we would actually like to see that could then squeeze out the current system as it develops . so for instance when arizona says something like they s going to ban ethnic studies we think oh no there s not going to be ethnic studies because the state says so ! we presume the state owns ethnic studies and it actually can ban it . we don t say uh whatever arizona ! ethnic studies is not a gift from the academic industrial complex or from the state . it s a product of social movements for social justice and as long as they exist there will be ethnic studies wherever and whenever we go . and did we ever really think ethnic studies was going to be legitimate in a white supremacist and settler colonialist academy ? and if ever did become legitimate we would know we had failed in our task . 	male
337	 but then who would be first lady ? lol 	male
338	 are name sure name are alright with driving a stick shift ? 	female
339	 are name lesbian because a man hurt name ? 	male
340	 oh it s so soft it s like a loofah ! 	male
341	 while i welcome a majority of the new laws to be implemented this year i don t quite understand the required teaching of gay lesbian contributions . starting students in california must receive mandatory lessons in history classes about gays and lesbians and a ban will be enforced on teaching materials that reflect poorly on gays . while i understand the teaching of cultural advancement . . . i don t get how california s government can justify the need for this . what we want is for gays lesbians and straight people to live together in harmony how does separating their accomplishments do anything good at all ? is there a straight peoples accomplishments section in history books or is that not required ? 	male
342	 granted name won t have a normal family . 	male
343	 but what would name think if someone came in with purple hair ? 	female
344	 name s brother is such a girl ! 	female
345	 sorry that must be my black coming out . 	male
346	 if name don t like it here then why don t name just move somewhere else ? 	male
347	 wow name s really good at this ! 	female
348	 we can t have equal representation the whole political system would collapse . besides men from well educated backgrounds public school boys like us are the best trained to lead the country saying that they take the needs of women into account less than the needs of men is completely untrue . if name care so much why don t name run for parliament ? 	female
349	 no it s a man s job . 	female
350	 name can t be black . name listen to rock music . 	male
351	 this is a rotating set . . . it can be pushed easily by one strong guy or three or four wimpy girls . 	female
352	 i just don t understand it . i think name must just be doing it for attention . when this phase is over and name go back to putting effort into name s appearance name can be treated with respect . 	female
353	 don t worry about mr . . he s just extremely jewish . 	male
354	 push like a man ! 	female
355	 i feel like such a fatty no offense . 	male
356	 oh . . . so i m just going to put that name aren t sexually active at this time . 	female
357	 omfg ! it s like little mexico beneath my floors ! new neighbors moved in below us and all i hear are babies crying and the bass of latino music ! 	male
358	 hey ! white girl ! i love name ! name are beautiful ! 	female
359	 i m fine with gay people as long as they aren t gay around me . 	male
360	 name talk white . 	male
361	 the gay couple who moved in next door are not as comically flamboyant as the gay people on tv . it s like they s not even trying . 	male
362	 are name married ? are name single ? if name s single go out on a date with me . then i ll sign . are name single ? 	female
363	 would name like the green card or the pink card ? the green card ? are name sure ? i thought name would prefer the pink card . 	female
364	 all textures welcome . . . we can fix that ! 	female
365	 oh i m just with me and her . . . friend . 	male
366	 she should be the employeer and she needs to be a mexican looking for a cleaning job . 	male
367	 well there are many meanings of the word rape other than what name s talking about . 	male
368	 the fact that asexuals are going to end up alone makes me so sad . . . . i just don t understand what would bring them together with someone with out a physical attraction . 	male
369	 can t wait to show all my friends my ghetto fabulous ride . she needs a name . . . something ethnic . . . . laquisha ? 	female
370	 well name s almost white . 	male
371	 name don t sound chinese to me . 	male
372	 haha see ? i told name obama s not human he s a gorilla ! 	male
373	 name s a boy ! boys don t cry ! do name want people to think name s a girl . 	female
374	 there s no bitch in team . 	female
375	 oh name s so exotic . 	male
376	 i looked like a hoodrat . 	male
377	 i m having a problem with table wait do name know them ? oh just checking . anyway . . . 	male
378	 don t get too extreme okay ? we don t want name all to be prostitutes . . . or transgender . 	female
379	 what if name accidentally slept with a schizophrenic guy and had a nutter baby ? 	male
380	 i mean i m all for feminism . . . but i just worry that if women all join the workforce birth rates will plummet and the human race will go extinct . 	female
381	 i m sure name can speak to this . 	male
382	 my first words to her were what any father would say to their own daughter what were name thinking walking alone like that ! 	female
383	 i wish i could bring my dog out to eat with me ! 	male
384	 name s gained weight ! 	male
385	 lesbians shouldn t be allowed to use sex toys they made their choice . 	male
386	 name s a woman name can t carry that . get name s brother to do the men s work . 	female
387	 there is a difference between not believing in gender roles and encouraging name s kid to be a homosexual . 	female
388	 are name ladies familiar with science fiction at all ? 	female
389	 name can pitch a tent . 	male
390	 what s up with all these girls dressing like streetwalkers lately ? if women don t want to be known as sex objects they shouldn t dress like one . 	female
391	 if she wears those shorts out there it s her own fault if she get s into trouble . 	female
392	 i hear these spanish and oriental kids speaking and i think they must speak english because they go to school and have to communicate with their teachers . 	male
393	 women are naturally attractive . why do name think when name open a magazine for something like cars or video games there s girls everywhere but when name open a magazine for women there s girls there too ? 	female
394	 name d be soo pretty if name lost weight . 	female
395	 i heard this woman on tv say she didn t feel like a woman because of her weight . i just don t want name to feel that way . 	female
396	 i ll give name a pound for every pound name lose . 	male
397	 i do all the work she s here for name s entertainment . 	female
398	 i don t get those people . why can t they just wake up and decide they s a guy or a girl ? 	female
399	 well of course name don t know very much about cars . name s a girl . 	female
400	 name sound like name should have been born a girl . 	female
401	 she doesn t iron his clothes and she doesn t even cook for him . 	female
402	 where s name s kalashnikov ? 	male
403	 i have one of those who helps me pick out clothes . 	male
404	 why do we need to campaign for abortion rights in this country ? 	female
405	 name don t like spicy food ? ! ? what about all name s spicy jamaican puerto rican blood ? it s in name s genes ! 	male
406	 name s so pretty what are name doing here ? 	female
407	 there s hot girls all around but he wants a committed relationship . who wants a committed relationship ? what are name fucking gay ? 	female
408	 do name speak chinese ? 	male
409	 i feel like not being attracted to someone because they are black or white is the same as having a preference with hair color . 	male
410	 women know nothing about cars . 	female
411	 ugh exams suck thisisgayerthanaids 	male
412	 bisexual people don t exist . gay people just say that so they can walk down the hall with a girl holding hands . 	male
413	 welcome to america ! give me a call . 	female
414	 women s studies ? what do name do in there burn name s bras and march around school for women s power ? 	female
415	 don t sit like that ! boys don t do that ! 	female
416	 how is it fair that some people can get scholarships for just being black ? where is my scholarship for being a hard working person ? 	male
417	 don t name think name s reaction was offensive to others as well ? 	male
418	 come nappy leave happy ! 	male
419	 i told my daughter she s too pretty to play football . 	female
420	 the ones breaking the school rules are always black people . the teachers don t do anything even when they see it happening because they are afraid . i think that i am being discriminated against because i m white ! 	male
421	 girl name s not bi . there s no such thing . name s just horny and greedy . 	male
422	 well if name do decide to have sex with men be sure to use a condom . 	male
423	 how long have name been in france ? name speak french so well . 	male
424	 i m raising my son so that he ll be a good husband to his wife and a good father to his children . 	male
425	 name are alienating me because name s not speaking in english . 	male
426	 name can replace a lot of people in life but name only have one dad . 	male
427	 god i love it here there s so much culture . 	male
428	 i don t think black people should be allowed to use the word n 	male
429	 stop ganging up on me ! it s so hard to be a male in this household . 	female
430	 i am so sick of apologizing for being white . 	male
431	 oh my god ! will name be my new gay best friend ? we can go shopping for clothes ! 	male
432	 are name guys ready to take instructions from a woman ? 	female
433	 i wish i could play a schizophrenic . i think it would be fun . 	male
434	 don t worry . she ll change her style soon . 	female
435	 leave name s master s degree off name s resume . i think name s education and name s ethnicity are making white people nervous . that s why name are not getting a job . 	male
436	 but name s so smart ! 	male
437	 name should have been born asian ! 	male
438	 two strong men needed to lift some furniture . 	female
439	 apparently her husband s making it big ! 	female
440	 well she s puerto rican but she doesn t come off as latina . she comes off more like business name know ? 	female
441	 name know taking up running or something would really be so much cheaper . 	male
442	 . . . and her hair evokes a geisha . 	female
443	 we can split a dessert . that way name won t feel guilty . 	female
444	 i hate an indian giver don t name ? it s a gift . . . keep name s gift . 	male
445	 maria makes a good point . . . 	male
446	 name don t look disabled . . . 	male
447	 i know what i just said sounds prejudiced but i m really not . 	male
448	 have a good life to a good but fat kid ! 	male
449	 name have to think about how something like that would look on name s resume . people might make assumptions . 	male
450	 i want to steal a black baby . black babies are just so much cuter than white babies ! 	male
451	 wow name don t sound asian on the phone ! 	male
452	 im offended that black people can call white people racial names but us white people cant call them racial names back or its discrimination 	male
453	 hi miss woman with a phd do name know where dr . male colleague without a phd s office is ? 	female
454	 i call name that because that s what name are . name s chinese . name s oriental . it s what name are . 	male
455	 seriously i would totally date name if name were skinny ! 	male
456	 she goes from a geisha tease to a ninja with ease ! 	female
457	 that s not what a real man would do . 	female
458	 how d name get a regular name ? 	male
459	 that s ghetto ! 	male
460	 no offense but that s seriously gay . 	male
461	 most workplace harassment is a case of women being oversensitive about the advances of men . 	female
462	 kaitlyn sure can kick good for a girl . 	female
463	 oh name look like name s parents own a restaurant . 	male
464	 why do homosexuals keep whining about marriage ? they should be happy with the rights they have right now . 	male
465	 name should enter a few more tournaments . a pretty girl like name will do well with the male judges . 	female
466	 that is such a hawaiian thing to say . 	male
467	 make sure name give it to a pretty girl ! 	male
468	 i said a normal name . . . . . . american ! ! 	male
469	 i asked name out because name are so pretty if i had known that name were also really intelligent i wouldn t have asked name out . 	female
470	 no one really needs to study that ! 	male
471	 asians drivers no survivors ! 	male
472	 why can t we interview name ? we s trying to do something for name s people . 	male
473	 name s so beautiful why are name still single ? 	female
474	 no offense but women ruined the navy and the military in general . things were a lot better when it was just men on ships because that way they could be real men . 	female
475	 life only gets harder . get over it . 	male
476	 name need to get out of name s comfort zone . 	male
477	 twinkle twinkle little whore name s at school not jersey shore . name s a slutty orange mess please go find a longer dress . 	female
478	 i feel so bad for them women working in a fabric store because they don t have anyone to carry the heavy things . 	female
479	 sluttiness is just a sign of desperation but its not like i don t like it . 	female
480	 any room for me between there ? 	male
481	 that s um well i s always been just baffled and irritated by that . well no i don t want a penis . why would i want a penis ? 	male
482	 big boys rape our young girls but violet gives willingly 	female
483	 name s pretty for an asian . 	male
484	 practicing already huh ? 	female
485	 name s english is excellent . 	male
486	 to me nigga is like a bro term . a term of endearment . 	male
487	 name s not gonna believe this . today i just found out they make plus sized jewelry ! how fucked up is that ? i mean if name s so fat that name can t even fit a regular necklace around name s neck name need to seriously rethink the way name s life is going right ? like what are they thinking to let themselves get so big ? 	male
488	 we should take points off for the grade with the most promiscuously dressed girls at homecoming . 	female
489	 name have so many black friends . 	male
490	 oh god no ! i would never date a woman ! 	male
491	 oh name ll get in name s a girl and name s a minority . 	female
492	 i love broadway musicals lady gaga and karen walker . i m a gay man trapped in a woman s body . happy national coming out day . 	male
493	 i hope they s whistling at name . 	female
494	 stop acting like a princess ! name s acting like a princess ! ! ooh . . . little princess . . . boo hoo . 	female
495	 me suki suki name long time ! 	female
496	 of course i love name i just prefer the straight part of name to the gay part . 	male
497	 people confront name and it s not once in a while it s all the time she said . each time is like a little paper cut and name might think well that s not a big deal . but imagine a lifetime of that . it hurts . 	male
498	 mr . surname 	female
499	 do name know what i love about name ? name s so stereotypical . 	male
500	 well i have trouble concentrating too sometimes . everybody does . some people can manage it though and some can t . 	male
501	 no don t say that infront of ! she s half black ! ! 	male
502	 oh i m just taking sarah and her friend to the mall . 	female
503	 where are name from ? 	male
504	 are name sure name aren t just on name s period ? 	male
505	 name should look for an internship . most of them are unpaid but it s a really great way to get into the field . 	male
506	 that s gay . 	male
507	 do name speak english ? 	male
508	 of course he said no to name . men are shallow and weak minded name s not going to get a boyfriend unless name wear high heels instead of name s converse and low cut tops instead of name s t shirts and stop acting so independent nerdy and intelligent . start acting like a proper girl or get used to being alone . 	female
509	 lgbt people are six times more likely to attempt suicide than normal people . 	male
510	 name s mine . i m name ss . that s how it works . 	female
511	 name ll make a great wife someday ! 	female
512	 name two are getting married ? that s great . i hate getting those calls from girls crying that they can t pay rent because their boyfriend moved out on them . name know . . . knowing glance and chuckle aimed at my male partner 	female
513	 oh name s dressing like a lady today . name should keep that up . name make a much better girl . 	female
514	 are name sure name s not pregnant ? 	female
515	 name need to smile more and project more warmth in name s voice . also name need to suggestive sell more often . i know name can smile more and be nicer . i s seen name do it . i don t ask other people to do it but name are so good at it so i expect more out of name . 	female
