516	 so have name had a bi phase ? 	male
517	 some kids want to play violent games or lame girly games that aren t violent enough . 	female
518	 wow ! name s a good drummer . . . for a girl ! 	female
519	 quiet down ! name s acting like a bunch of wild indians ! 	male
520	 we all have things other people shouldn t know about . 	male
521	 take it as a compliment ! it just means name s young and attractive name ll be wishing for that attention in years . 	female
522	 blonde or brunette ? 	female
523	 well name can t reasonably expect health care providers to know anything about name s situation . i mean name s transsexual and that s pretty weird . i don t know why name s so upset about this . name should really be more tolerant of people who don t get it . 	male
524	 i d like two tickets to the next show and a smile caitlin . 	female
525	 oh but name s latin so name must love the heat ! 	male
526	 go home . 	male
527	 yeah well medical school and being a doctor can be really hard for women . it s hard to manage that and have a family . 	female
528	 me love name long time . 	female
529	 name can t be smurfette name s black . 	male
530	 she s too sensitive . why should she get upset at me for calling her what she is ? 	male
531	 is there any way to make it so that ebonics shows up under the google translate button ? i m curious to know how black people interact with the site . 	male
532	 i like that name s bi because it means name d be open to a threesome . 	male
533	 maybe name s just not really a lesbian . 	female
534	 job applications done . responses . being a white male in the st century sucks . 	female
535	 i have to admit i am relieved name s not taking it all the way to becoming female i think that would have been an adjustment i d have a great deal of difficulty making . 	male
536	 a woman on a motorcycle ? ! ! hahahahaha ! 	female
537	 oh name s not like our other indian colleague . name s light skinned name s okay . they just talk about how brown they are . 	male
538	 name s really un intimidating for a black guy . 	female
539	 name s pretty for a tamil girl . 	male
540	 immigration ! 	male
541	 oh my god ! wow . just . wow ! that s really unbelivable i never would have guessed ! 	male
542	 it won t work if name don t smile ! 	female
543	 name s smart for a mexican . 	male
544	 i won t ever use the word cisgender it s a useless word . 	male
545	 relax ladies it s no big deal ! 	female
546	 seriously name s not going to pay for her ? 	female
547	 hot tranny mess . 	male
548	 if someone called me feminine it d be like calling me a faggot . and if i called some chick masculine well . . . that s just unfortunate for her ugly ass . 	female
549	 look at the women fooling around in the kitchen . 	female
550	 sorry if name can t get married now ! 	female
551	 the whites have become black . 	male
552	 haha ! name look like my girl did last night when i was done with her ! 	female
553	 i had a chude moment i didn t know if it was a chick or a dude . 	female
554	 i was fully qualified for the job but they gave it to a black girl . 	female
555	 my advice to name stop wasting name s time and look for a job that will pay the bills . 	male
556	 of course i m attracted to pamela anderson ! what normal man wouldn t be ? 	female
557	 name much more refined than other black girls . 	female
558	 wow name are getting pretty good at that thing . 	male
559	 name just need to get laid . 	male
560	 like a donut the face needs to be tastefully powdered so that it catches the eye of hungry construction workers . don a deliciously dapper mug with today s groupon to oasis day spa . 	female
561	 name can t play with them they don t speak english . 	male
562	 why do name talk so white ? 	male
563	 surveying gender is easy because there s only male and female . 	female
564	 it s okay . i won t think of name as jewish . 	male
565	 sorry name can t do this trip with name s high school friends . . . sorry name can t qualify for scholarships . . . sorry name can t work here . . . sorry name can t open a bank account . . . sorry name can t live here . 	male
566	 would it bother name if i called name nigger ? 	male
567	 why do name try to look so unfriendly instead of like a nice girl ? name ll never get a job when name look like white trash . 	female
568	 that s her ? she s beautiful ! when name said she dated dave i assumed she d be a beastly creature ! 	female
569	 believe me my son is not gay . he has never once touched a barbie he s built like a linebacker and he s a real man s man . 	female
570	 no can name get one of the boys to carry that out ? it s too heavy for name . 	female
571	 wait can i catch name s asperger s ? 	male
572	 my pastor said name guys like worship the darkness . is that true ? 	male
573	 name s too white washed to speak spanish . stop it . 	male
574	 anyone who can get a girl to enroll in this class gets extra credit . 	female
575	 she s pretty for a black girl . 	female
576	 i ll believe it when name don t just hook up with girls but actually bring one home as name s girlfriend . 	male
577	 name look so pretty washing the dishes ! i m glad name s learning young . that way when name get married name ll know what to do . 	female
578	 hey if name don t like it when they use gay like that then don t pay attention to them . don t let name sself get so worked up about it . 	male
579	 name s asking for trouble with those jeans . 	female
580	 name aren t really disabled . 	male
581	 name guys are really good gardeners . 	male
582	 i m fine with homeless people who have psychological disorders but what i don t understand is normal people who have to be homeless . why don t they get jobs ? why don t they get help from family ? 	male
583	 we all fall into those roles eventually . 	female
584	 wow that s really irresponsible of name . 	female
585	 how does a woman get the idea to study computer science ? 	female
586	 wow i m so autistic . 	male
587	 gender and birth date are two fields that will never change . 	female
588	 what can name do with curly frizzy hair ? make it go away ! 	male
589	 don t get all manic on me now . 	male
590	 name look normal . 	male
591	 well name must like this weather right ? 	male
592	 there s a black doll at the dollar store named alexis it s like a ghetto mini me ! 	male
593	 why doesn t she look like a girl ? she looks like a boy . 	female
594	 did name cut name s hair ? we don t like short hair on our girls in this family . 	female
595	 name know if i were hiring for a job like that i don t know that i would hire name know a young lady . 	female
596	 i didn t know girls played video games . 	female
597	 do name speak norwegian ? 	male
598	 asian toddlers are the cutest things in the woorld . adopting a few on ebay . no . . . but seriously . 	male
599	 oh i watch that show outsourced ! jai ho ! ! 	female
600	 no i can tell name aren t . name have lighter skin so it s impossible . 	male
601	 people of mixed race are so beautiful ! puerto rico has the most beautiful women ! 	female
602	 being bi is just a transition step between straight and gay . people who are bi just need to choose ! 	male
603	 i was kidding . i know name s puerto rican not mexican . and i think that s pretty sexy . 	male
604	 but name s so cute ! why do name want to be a boy ? 	female
605	 i m male and am asking this question to non binary identified people . why do name give so much of a crap ? why can t name just lighten up let the thread happen and ignore it ? 	female
606	 what are name ? 	female
607	 i still love name and accept that name were born this way but name got it from name s dad . his side of the family has the queer genes . 	female
608	 . . . but there was a lesbian couple in line who were saying a really passionate goodbye for like half an hour so i didn t mind the wait . 	female
609	 indians meaning first nations are paid a month to sit on the couch and do nothing . 	male
610	 well what were name wearing ? 	female
611	 we s very sorry if we offended name . this was very uncomfortable for us . the problem was not name g d forbid but that name s relationship would become a topic at the shabbos table that might cause our other guests discomfort and confuse our children . again we apologize for offending name . shabbat shalom . 	male
612	 alright love how name doing tonight ? name look lonely want some company ? 	female
613	 name know how rap has always been my phone and my car and i m awesome and saying my name over and over again and my jewelry and my money ? and it wasn t until eminem came along that vulnerability was brought to it ? he raps about the embarrassing things about his own self instead of posturing . 	male
614	 name should apply for the assistant manager job . name s the most knowledgeable here and besides for a female name s got a backbone . 	female
615	 that s crazy . 	male
616	 wow ! name s so articulate ! ! 	male
617	 name s husband just called and said that name can buy whatever name want . 	female
618	 wow what does name s dad do ? 	female
619	 name can get the smaller one . 	female
620	 this is not the way the only woman at the party should behave . 	female
621	 oh that s so cute . is name s boyfriend a tuba player ? 	female
622	 fatpeoplenightmares 	male
623	 it d be so easy name s fourteen and girls already plays like teenagers . 	female
624	 oh i love the gays ! i don t know what i ll do without my gay boyfriend ! 	male
625	 name s so pretty ! what are name mixed with ? 	female
626	 oh i didn t know that was name s mom . name s adopted right ? 	male
627	 i raped that test ! 	female
628	 well to be fair the same thing can be said about me because i like weed . only worse because i can be arrested for it . the morale to the story is stfu about personal stuff when name s trying to get a job or get an apartment . not being mean there s just no reason to disclose that information to potential assholes that can cost name name s livelihood . 	male
629	 is name s sister name s sister ? and is she name s moms real child ? her nose isn t large and wide like most black peoples . is she mixed ? etc . 	male
630	 i m not going to screen name for stds because name aren t really at risk as a lesbian . but then again i don t really know how name people have sex . 	female
631	 if name girls have any experiences of name s own to share in class name s welcome to . 	male
632	 name don t have add . if name did name wouldn t have been able to do thing i did . 	male
633	 i have never found where are name from ? offensive and the asker wasn t questioning name s citizenship ! 	male
634	 well that s ok name s a girl . 	female
635	 why do name watch name s interpreter so much in class ? name should try harder to listen to the other students when we have discussions . . . it ll help improve name s hearing don t name think ? 	male
636	 it doesn t make sense to consider street harassment real harassment or pretty soon men won t even be able to talk to women without it being called sexism . 	female
637	 maybe name just haven t slept with the right man i can turn name right baby . 	female
638	 konichiwa ! 	male
639	 umm . . . are name s parents home ? 	female
640	 why isn t there a white history month ? 	male
641	 hey honey name s going the wrong direction the border s that way ! 	male
642	 father daughter talk . . . my daughter just walked into the room and said dad cancel my allowance rent my room out throw all my clothes out take my tv iphone ipod and my laptop . please take all of my jewelry . then sell my car take my house key . and then write me out of name s will . well she didn t put it quite like that . . . she actually said dad this is my new boyfriend mohammed from iran . 	male
643	 it s not that i don t like him it s just that . . . i think he has asperger s or something . he always does awkward stuff like pacing around . it s really weird . 	male
644	 i think modern medicine is stupid . it s causing overpopulation problems because people aren t dying quickly enough . 	male
645	 oh no we won t get anything done today too many hormones . 	female
646	 are name on name s period or something ? 	female
647	 i need to know are name looking for a career or are name looking to get married ? 	female
648	 name s going to be the expert on all things african american . 	male
649	 i m not going to hug name . name didn t lose weight . . . if name want a hug from me next time lose weight ! 	male
650	 just smile more . 	male
651	 i mean he s so rich and powerful why would he even risk having sex with a maid ? 	female
652	 did name beat up name s boyfriend or something ? wink 	female
653	 yeah it s like when black people dye their hair blonde and wear neon colors . it just doesn t work ! 	male
654	 look at the color of name s skin ! name should know spanish ! 	male
655	 it s only happened to name like two times . 	male
656	 don t pick that up name s a girl . let one of the boys do that . 	female
657	 name s actually very pretty . most dark skinned girls don t have name s looks . 	female
658	 let me guess . . . name s here for passport photos right ? 	male
659	 i seriously doubt all non sexual claims . 	male
660	 wow name s just all around evil aren t name . 	male
661	 so are name a full time lesbian now or just bi ? 	female
662	 i know name s a lesbian but why do name have to be so masculine ? 	female
663	 it s too bad name ll never have kids since name s a lesbian . 	female
664	 name speak english really well for someone that s an immigrant . name don t even sound hispanic . 	male
665	 hey ! hey ! why do name look like a boy ? 	female
666	 i wish name didn t have to miss out on dating boys . boys are fun . 	female
667	 name wouldn t have really gone without him or another boy with name right ? 	female
668	 name haven t seen the godfather movies ? ! name are not really a man if name haven t seen them . 	female
669	 those things are terrible but name really just have to ignore them . just let it go and it will go away on its own . 	male
670	 so are name still bi ? what does evan think ? name d better not put that on name s facebook profile ok ? and don t say anything to name s dad . 	male
671	 name have to wonder if in his heart of hearts he knows what he s doing is wrong . 	male
672	 oh that s so sweet i was a feminist when i was name s age too . 	female
673	 all right ! i just raped my electrical engineering exam ! 	female
674	 doing a physics degree is no way to get name sself a husband ! 	female
675	 that s my girl ! 	female
676	 the abuse that fat people receive is terrible . instead of insulting them we need to teach them how to eat and exercise properly for the sake of their health ! 	male
677	 what s she got that stick for if she can read that book ? 	male
678	 are name enjoying name s vacation in the united states ? 	male
679	 wow name eat so healthy ! 	male
680	 the debt crisis and the lord of the rings both have elaborate plots too many characters to keep track of and talking about either of them repels girls . 	female
681	 oh those guys were just trying to holler at name ! 	female
682	 hahaha name s so funny ! name s not asexual ! there s no such thing ! humans are made for sex ! name just haven t had good sex yet ! someday name ll meet the right guy and name ll want to screw his brains out and then name ll remember how insane name were to ever say name s asexual ! 	male
683	 is the kids meal for a boy or a girl ? 	female
684	 racism is bad but every stereotype has some truth . 	male
685	 that haircut is usually cute on punk and goth girls but name should have kept the bangs in the front . it s more feminine . 	female
686	 would name like a newspaper young lady ? 	female
687	 girls run away from their families for two different reasons . either they s chasing after something or they s running away from something . 	female
688	 name can move the printers next week . name ll need to get some strong guys from the lab to move them . 	female
689	 are name normal ? 	female
690	 is name s dog oriental too ? 	male
691	 we don t consider name an american . name don t act or think like all the other domestic students . 	male
692	 i like to imagine name as a girl but name s sentence structure and rhetoric is so concise and to the point which points to the contrary nothing against women simply factual . 	female
693	 that s why i m not a lesbian . 	female
694	 gentlemen this foundation has awarded a scholarship grant . . . 	female
695	 unless female student complains about his flirting there s nothing i can do . 	female
696	 what is that smell ? is that chinese food ? how can name stand that ? we have to air the room out ! 	male
697	 god made adam and eve not adele and eve . 	male
698	 name s hair isn t a disaster but name looked so much prettier with longer hair ! 	female
699	 don t become one of those militant gay people . 	male
700	 when name get married name s surname will be asian . that s fucked up . 	female
701	 wouldn t name rather have the princesses than captain america ? 	female
702	 that s a little inappropriate for a boy don t name think ? 	female
703	 i googled name . why on earth do name have a japanese girl s name if name don t look japanese ? ! 	male
704	 name want to say mi novia . if name say mi novio it sounds like name have a boyfriend . 	male
705	 washington redskins . it would be offensive but there s not enough indians left for it to be offensive to . 	male
706	 why don t name fax him a picture of name sself ? i m sure he ll get that memo to name faster . 	female
707	 and who is this lovely exotic young lady over here ? 	female
708	 name know obama may have black skin but he was basically raised white . 	male
709	 when did name s father leave home ? i think name have problems with male authority because name s father isn t around . 	female
710	 can i tell them ? ? ! ! she s a lesbian too ! 	female
711	 but name s too young to have arthritis ! 	male
712	 i really don t understand why name are so invested in women s rights and fighting sexism and stuff these things clearly don t affect name . 	female
713	 well won t name make a good wife some day . 	female
714	 there are some funny women but even on the stand up circuit where there s no one casting anything women are not proportionally as funny as men . 	female
715	 name were born with white skin like name s dad s . name s so lucky . it s too bad name didn t get his blue eyes though . maybe name ll pass them on to name s kids ! 	male
716	 name know name s really cute for an over sized girl . 	female
717	 name like hip hop don t name ? 	male
718	 let me guess nursing ? 	female
719	 don t name wish name had a normal english name like jane smith ? 	male
720	 bisexual is a term that gay guys in high school use when they want to hold hands with girls and feel like a normal person for a change . 	male
721	 don t worry the neighbors are really nice and they won t think anything about name s furniture . . . 	male
722	 how do name spell margarita ? 	male
723	 oh he s very nice . he s so intelligent and always happy and smiling and very professional . pause he s black name know . 	male
724	 look at her she came back even lighter from europe ! 	male
725	 i s always wanted to do female oriented entertainment . i s always related to women more than guys . . . i watched a ton of romantic comedies . 	female
726	 maybe this is racist but can i borrow some wite out ? 	male
727	 i just called name in here to let name know that we don t tolerate any kind of shenanigans from name s kind here . 	male
728	 name need to look at technical schools . name don t come from the right family background to go to college . 	male
729	 yeah but name s not like most of them . name s smart a hard worker . 	male
730	 name don t look autistic . 	male
731	 the hardware store for women . 	female
732	 well i hope name didn t hurt his feelings . 	female
733	 broadway was a trail left by the indians long before any americans came here . 	male
734	 sugar or spice is alright but i ll pass on the chocolate and rice 	male
735	 one way of checking if someone who s collapsed is okay is to check the inside of their lip is still pink . now daisy isn t the same colour as the rest of us but if she opens her mouth name ll see it s the same colour as ours . 	male
736	 oh no i m sure name s grandma and aunt aren t dirty haitians they s name know good haitian . 	male
737	 i didn t know that such a dark girl could be pretty . 	female
738	 whenever i see a group of black guys near me i run away or stop dancing . . . i don t want one of them to start dancing with me or try to do something to me . black guys are like so scary ! 	female
739	 name don t count ! i want the camp kind of gay who will come shopping with me and watch chick flicks . besides name s a girl at heart anyway . 	female
740	 are name going to permanently straighten name s hair or get a weave ? i mean name d be a lot prettier if name did . 	female
741	how do i repost one of name s posts ? i know how to repost on other tumblr s but name ss is confusing . help ! also can t find where to like a post . . . 	male
742	 living without god is like aunt jemima living wthout syrup like uncle ben living without rice . . . 	male
743	 oh name s not here to hook up with guys . 	female
744	 he s a really good writer . 	female
745	 god damn some people . 	male
746	 yeah there s this chinese girl in my dorm . she said her name s sarah i don t know what her real name is though . 	male
747	 wow look at all these black kids . hey i bet they all have the same dad . all black people are totally related . 	male
748	 i never knew there were black goths ! 	male
749	 that s funny name don t seem hispanic . 	male
750	 is english name s second language ? 	male
751	 name have to think about how something like that would look on name s resume . people might make assumptions . 	male
752	 black male scientist is an excellent scientist . not just an excellent black scientist an excellent scientist . 	male
753	 of course anyone has the option to become a stay at home mom that s what welfare is for ! 	male
754	 i don t believe in quotas . i think name either make it or name don t . 	male
755	 what are name deaf ? 	male
756	 i don t know how well this software facial recognition software will work in places like asia because all chinese people look the same . 	male
757	 name ll be fine ! just talk like a white person . 	male
758	 that s just the black in him coming out . 	male
759	 and we all know bisexuals are just on the road to being gay . 	male
760	 oh of course name will change name s mind . all women do . 	female
761	 name two boys can do this stretch against that wall . 	female
762	 all the good men are taken and all the rest are handicapped . 	male
763	 this isn t work related but just an fyi since i know name are interested in women s issues . 	female
764	 seriously i get so tired of people trying to find racist or sexist undertones in stuff . keep perpetuating it up so it never dies that ll work . 	female
765	 is name s mother an oriental ? 	male
766	 a lot of asians . 	male
767	 so name ll bring a jewish dish . coworker could bring a chinese dish ! i ll ask coworker to bring something indian . 	male
768	 it was really horrible . there were like five indians and they all sat around talking about like brown shit and it was the most shitty thing ever . i was hoping that there would be someone i could talk to but they were all indian . i mean the tooly kind of shitty indian not like name . name s okay . 	male
769	 how come all the manly people are over here ? well name s playing a video game right now so name lose name s girl status . 	female
770	 wow . name speak so quickly and name enunciate name s words so well ! 	male
771	 how can name be a feminist ? name s a dude . 	female
772	 why are name getting the pink one ? 	female
773	 wait name went to ivy league school ? but name s family isn t rich ! 	male
774	 it is important for movements to have allies just like name and name s partner are allies to the queer rights movement . 	female
775	 hey i like name s suit and tie . . . but are name a dyke ? 	female
776	 hey ! hey ! are name a guy or a girl ? 	female
777	 i love gay guys they s so much fun ! i would love to have a gay guy best friend but lesbians are just annoying . 	female
778	 so which one of name s parents is arab and which one is jewish ? 	male
779	 i just want to help name love name sself and be more confident and maybe help name find a nice boy . . . 	female
780	 name like little cute dogs . that s feminine . 	female
781	 name like little cute dogs . that s feminine . 	female
782	 i always get the two of name mixed up i m not sure why . 	male
783	 women shouldn t be walking around by themselves . 	female
784	 why are there so many party stores in the ghetto ? like do all the poor people like to celebrate they s poor ? 	male
785	 name know that hairstyle is for guys right ? 	female
786	 name s dad said it might mean name s gay but i told him that was impossible . 	male
787	 is name s son in a hardship program ? 	male
788	 name can t really call name sself bisexual can name ? i mean name s been with boyfriend so long it hardly counts does it ? sister is gay but for name it was more like just a phase right ? i mean c mon name s the straightest person i know ! 	male
789	 what s the difference ? all these orientals are the same . 	male
790	 were they black ? 	male
791	 why do name listen to chinese music ? name don t even understand and they all look the same anyways . 	male
792	 i play as a black character sometimes and it never bothers me . 	male
793	 name ll have no problems getting interviews because of who name are . 	female
794	 oh sorry we kept name waiting so long . from name s surname on the form we thought name were black ! 	male
795	 people with southern accents always sound so ignorant and uneducated ! 	male
796	 well there are girls who have been kidnapped and raped by paedophiles because they were wearing short skirts . 	female
