797	 don t worry i m cool with the fact that name s gay . so when did name decide name were ? 	male
798	 are name co workers ? are name best friends ? 	female
799	 ma am name have to wait with name s own party ! excuse me ma am name have to wait name s turn ! 	male
800	 i m all for women s rights and freedom and whatever as long as they still put out . 	female
801	 i don t mind that name don t shave but some of the parents and definitely the school administrator won t like it . name should probably cover name s legs . 	female
802	 is that a good idea ? well . . . name want to be careful showing support openly like that . there are whispers predatory women . 	female
803	 we s not going near the drag queens ! 	female
804	 anorexic girls should just eat . 	female
805	 name better check to see who s behind name before name bend over like that . 	male
806	 if i can t get this name guys definitely can t ! 	female
807	 does bin laden due to the way he died look more feminine to his followers and thus more ridiculous ? 	female
808	 so which one of name s parents is white ? 	male
809	 a boy wouldn t want a dora the explorer toothbrush ! 	female
810	 oh no i don t go tanning because my mom says dark skin is really ugly ! 	female
811	 i don t want another woman boss . i already have a woman boss and she has me running around all the time . 	female
812	 she really pisses me off . . . 	male
813	 do name girls have children yet ? how old are name ? oh well name will have them soon . 	female
814	 i can tell name how to get a handicapped parking sticker it s so easy ! 	male
815	 i hate to sound racist but i think it s because we have so many chinese students here . these diseases all originate from pigs in china . 	male
816	 i don t know why name insist on making chivalry so difficult . 	female
817	 but did he hold a gun to name s head ? 	female
818	 why don t name just dye name s hair ? 	male
819	 oh come on what kind of asian are name ? thats why name s part of the team to do the math . 	male
820	 name pretty much have to be a minority to get into ivy leagues . 	male
821	 no no not that picture we need to find one where the girl has more clothes on she looks like she wants it . 	female
822	 hey ! name s uncle died . 	male
823	 oh my god that s a man . 	female
824	 name s a girl go over there . 	female
825	 god they should just shut up and be happy for me instead of making me feel guilty ! 	male
826	 name s going to take that home tonight ? 	female
827	 i wasn t sure if name were oriental because name s last name is wong but name s first name is english . 	male
828	i just have to say thank name so much for this blog ! it s so important for people to see how hurtful and detrimental these tiny comments are and the impact they have over time ! i hopefully am going to be teaching a section on microaggressions during a cultural competency training for an internship position i have . this blog is so great for examples on a wide variety of discrimination . thanks again ! 	male
829	 the best thing about name being gay is that name actually appreciate my shoes ! 	male
830	 name just know she s his mail order bride . 	female
831	 what are name wearing ? name look like a dude ! 	female
832	 do name play basketball ? 	male
833	 don t name want to get a man to carry that for name ? 	female
834	 is it a boy or a girl ? 	female
835	 man that test raped me ! 	female
836	 wow that s so complicated . i bet name really want to get married soon so name can have an easier one ! 	female
837	 i wonder how fast they had to run to steal those bags . 	male
838	 he seems so gay he s quiet he likes poetry and he has a lisp . but name can never tell him i said this because i don t want to make him feel like there s something wrong with him . 	male
839	 daddy why is there a girl here ? 	female
840	 is there anything worse than a woman being hysterical for no reason ? 	female
841	 name know how name s black and name just have to live with it ? that s how i view my clumsiness . i just have to live with it ! 	male
842	 i hope she s pregnant and not just fat . really not flattering . 	female
843	 she s not black is she ? 	male
844	 wow name s daughter s hair is beautiful . is it all hers ? 	female
845	 name s not bisexual . bisexuality doesn t exist . 	male
846	 name probably won t send me anything i haven t read before and i did volunteer work in the multicultural center here in town so . . . unnecessary . 	male
847	 well maybe they wouldn t bother name so much if name wore a bra . 	female
848	 i don t care if some gays somewhere get married . what i care about is when this begins to affect my children . 	female
849	 i like my women how i like my olive oil extra virgin 	female
850	 yeah name s really making a statement with those . 	female
851	 she s a dude anyone who wouldn t fuck me is a dude in my head . 	female
852	 are name the nanny ? 	male
853	 are name a child ? because name look like a child and sound like a child . 	female
854	does it ever just bum name out running this blog ? 	male
855	 i don t understand why name take everything as a racial comment ! 	male
856	 name know the difference between unemployment and welfare ? people on unemployment used to have jobs and were just laid off . people on welfare are lazy and sit on their asses all day . 	male
857	 do name seriously believe anyone thinks women have the responsibility to be sexually available to men ? i totally reject this concept . prove it exists and i will be willing to acknowledge the attitude . show me . give examples . 	female
858	 no name can t like him . it s the most disgusting thing to mix a black and an asian ! 	male
859	 it s ok name s a girl . 	female
860	 make hunger cry like a girl . 	female
861	 osama is dead . 	female
862	 why do name focus so much on rape victims ? men who go to war get ptsd too . don t name care about them ? 	female
863	 she s very butch . . . but cute . 	female
864	 name would make more money if name had a boob job . then name d be an instead of a . 	female
865	 wow ! looks like name s got a lot of food there ! 	female
866	 my sister has black people hair ! she has to use colored people shampoo ! i feel so bad for her like all her friends have pretty straight blond hair and she has like an afro ! 	female
867	 a young american patriot sybil ludington is the female counterpart to the more famous paul revere . 	female
868	 but they are farther away from me and not as fun . 	male
869	 name didn t shave name s legs ? that s disgusting ! 	female
870	 can name please not use the word queer ? it s a derogatory word . it makes me uncomfortable . 	male
871	 well they are allowed to read now so why can t they catch up ? 	male
872	 i don t think that s true . name s just not the type . 	male
873	 when i first saw name in class i thought whoa ! she s really hot . then name answered a question and i thought man ! big tits blonde hair and smart ? no way ! 	female
874	 it s okay that name s gay just please stick with white girls . 	male
875	 are name white ? 	male
876	 she thinks she s white . she won t wear any of the juicy couture clothes i got her . 	female
877	 name communicate like a girl i just don t get it . i m a guy . name need to just say what name mean ! 	female
878	 perspective of privilege eh ? by saying that many men mansplain aren t name in a de facto sort of way reinforcing sexism ? by stereotyping the behavior of some of the other sex 	female
879	 i m just saying there s no reason for name to carry name s suitcase when there s a strong capable man around to do it for name . 	female
880	 i believe in equal rights for gay people but i wish they wouldn t kiss in public . it s gross . 	male
881	 i don t really have an opinion because it s not my fight . 	male
882	 no disrespect man . 	female
883	 i don t know why she even bothers . if i were her i d put a gun in my mouth . 	male
884	 it was jenny s fault that her life was bad because she allowed being abused to affect her . forrest just moved on from everything that s how name should think . 	female
885	 oh i have one of those . 	male
886	 oh when did name get name s ear pierced and is that the gay one ? 	male
887	 no . it s bad enough to have one kid like . . . that . 	male
888	 i don t mean to be rude but . . . what are name ? name s ethnic mixture is gorgeous . 	female
889	 my daughter the man . 	female
890	 sure name didn t blow it out of proportion hun ? 	female
891	 i feel so shiftless no good and guilty . i might go wait by the bench . 	male
892	 name s an engineering major ? wow totally wouldn t have seen name as an engineer . . . i always picture them as men . 	female
893	 what s the point of being a gay trans man ? why didn t name just stay a straight girl ? 	female
894	 here taste this . name s the rice expert . 	male
895	 girl why aren t name smiling ? smile ! i m here so everything s cool . 	female
896	 it can be pretty hard to hear over the noise so ladies just yell at me like i m name s boyfriend . 	female
897	 if name cut name s hair name ll never get a boyfriend . no man wants to deal with that nappy hair . 	female
898	 boys will be boys . 	female
899	 wrestling is for people who are big and strong like boys . 	female
900	 oh look the joy luck club . 	female
901	 the women s studies department once held a sandwich making day in his honor . 	female
902	 i m proud of the woman name s become . i was so afraid name d be a lesbian when name were growing up . 	female
903	 smile sweetheart ! it s not that bad ! 	female
904	 i tend to make it one word because transgender and transsexual are one word and it s kind of my way of saying both at once even though they s different . 	female
905	 i can t work out how to do that that s not how girl brains work . 	female
906	 are name the one with the tipis or the one with the slurpees ? 	male
907	 look at name being all domestic ! 	female
908	 wow so name s family is like the song jesus loves the little children of the world ? name know red and yellow black and white they are precious in his site ? that s so weird but kinda cool . my family is down with interracial stuff too . i m descended from an indian princess somewhere along the line from way back when . 	male
909	 when name see crooked teeth name think name know trailer trash . 	male
910	 it s just that . . . name two stand out more when people enter the room because name s so . . . . 	male
911	 it s like i have two daughters ! 	female
912	 but name can t be a lesbian ! what will i tell my friends ? ! 	female
913	 name can t be a person of colour name s too pale ! 	male
914	 no homo . 	male
915	 damn right so this is cool and stuff 	male
916	 those women in the middle east are so oppressed . the saddest part is they are not educated enough to know anything else . they don t know any better . 	female
917	 just smile for me baby let me see that pretty smile . 	female
918	 just one nurse for all these doctors ? 	female
919	 well i wanted to go to columbia but of course i didn t get in because i m a middle class white guy . 	male
920	 i wish i was retarded . then no one would expect anything of me and i d have lower expectations of myself . i d be able to just sit at home and be retarded all day . 	male
921	 i s never seen name with a woman so in my mind name s just straight . 	male
922	 oh that chick is asking for it . 	female
923	 why are name atheist ? 	male
924	 i have lots of sympathy for women but i have no sympathy for feminists . 	female
925	 but is it really that big a deal ? 	male
926	 well don t lose too much weight or else name ll be way out of my league ! 	male
927	 i don t think i like name s tone of voice . 	female
928	 name s been kind of hogging the spotlight . 	male
929	 did name guys win the lottery or something ? living the high life ! 	male
930	 ya but it s not like a real disability . 	male
931	 it s okay i have gay friends . 	male
932	 name don t want to be a professor name want to have kids . 	female
933	 i don t understand bisexuals . why can t they just pick a side ? 	male
934	 no ma am . he s a decent family man citizen that i just happen to have disagreements with on fundamental issues and that s what this campaign s all about . he s not an arab . 	male
935	 i don t hate them just keep them away from me . 	male
936	 jennifer ringer as the sugar plum fairy looked as if she d eaten one sugar plum too many . 	male
937	 i don t wear colombian pride bracelets or drape colombian flags over myself . name know i have mostly white friends and it s not like i m gonna wear hoop earrings and show my ass off by wearing tight jeans . i m not gonna ask for it to be racially profiled . 	male
938	 lesbians and bi girls are different . yeah i guess it s kind of because they s hot . 	female
939	 why can t name act like a normal person ? name don t have asperger s . there s nothing wrong with name . name s just looking for attention excuses . if name d just stop behaving so oddly name wouldn t need to blame it on a disease . 	male
940	 the people i feel most sorry for in america are white men . they can t do or say anything without someone getting upset . 	female
941	 what ? but name s asian name s supposed to be smart ! 	male
942	 if name don t like it name can return it . i just knew that they had a japanese type scent and thought of name . 	male
943	 oh my god name s using a cane ! what happened ? ! ? 	male
944	 don t be afraid to be direct with me . i have nothing against strong independent women . on the contrary i find them attractive . 	female
945	 bounce shine and softness are the key to sexy hair . 	female
946	 i feel so bad for name . name s hair will always look like a bad perm . 	male
947	 well her boyfriend s all over our records . if she got involved with him in the first place she got what was coming to her . 	female
948	 eh but that s not even racist . 	male
949	 they native people need to stop being so difficult and complaining ! they already get so much from our tax money what more do they want ? 	male
950	 oh i would never date a bisexual . i d always worry they would cheat on me with a guy . plus they aren t seriously gay they are just pretending to be because it s hip . 	male
951	 i know my girls were raised sheltered and only around white people and if i had to do it again i would . 	male
952	 i know my girls were raised sheltered and only around white people and if i had to do it again i would . 	male
953	 well at least he s not a laborer . 	male
954	 name can t be a high school teacher . name s too pretty so the boys won t respect name . 	female
955	 america has a white majority and a far larger one in most of the country s past so why wouldn t the american girls dolls have one as well ? 	female
956	 where are name parked ? 	male
957	 y all are pretty for some black girls ! 	female
958	 how is name s recovery going ? 	male
959	 name realise she was complimenting name right ? name get offended too easily . 	female
960	 so is it true what they say about asians ? 	female
961	 name s not what i expected . 	male
962	 the only reason women make up more of the rape statistics than men is because men are less likely to make a big deal about it . 	female
963	 when have name ever seen a monster with blue eyes ? 	male
964	 is that about supporting illegals ? who here is an illegal ? 	male
965	 one of my good friends from high school is black but i don t really think of her as black because she told me she s white on the inside . 	male
966	 what are name doing here ? 	female
967	 well it s probably the asian part of name . asian people are always so modest . 	female
968	 this is gay . everyone in the class is doing as badly as me ! 	male
969	 so how much indian are name ? i mean name don t look it . 	male
970	 a college student huh ? so nursing or teaching ? 	female
971	 we s paying full fees for our daughter to go to school and they still ask us to donate our time ! and i just think why not ask these families on financial aid who are only paying a couple thousand bucks ! ? if name can t give name s money name should give name s time name know ? 	male
972	 one day i will invite name to my place name ll like it it s decorated mexican . 	male
973	 i mean they s asian . they ll leave little notes and chocolates . 	male
974	 she s indian or muslim or something . they just wait for their husbands to tell them it s time to have a baby and then they get pregnant . it s sad . 	female
975	 name need to move to a safer a neighborhood . 	male
976	 before name meet name s new coworker i should warn name she s lesbian . that s why she dresses like a man . 	female
977	 name have such nice hair not like most blacks ! are name half white ? 	male
978	 i m not prejudiced but when i hear about some crimes on the news i just know it s going to be a mexican . 	male
979	 everything we read in this class is so outdated all this stuff about men dominating women . why don t we talk about current issues ? 	female
980	as someone who is trying to become a teacher and dreams of being a teacher it really kills me when i see the submissions that are said by people s teachers . it s so disturbing . 	male
981	 maybe she was a mail order bride . 	female
982	 i wish i could fix name s son for name . 	male
983	 this new piece is a little different . it s by a female composer so we ll see what happens . it s dedicated to all of the females in the orchestra . 	female
984	 oh name are native american ? name don t look native are name sure ? 	male
985	 name might have trouble finding participants for that study . 	female
986	 name s actually smart . name hardly have an accent . good for name . 	male
987	 this is why we get along ! name totally get my f d up sense of humor . like i always think about this list of objects that would be perfect looks around and lowers her voice black girl names . like dijonnaise or medulla oblongata ! 	male
988	 i don t want to worry name but something is wrong with her eyes . 	male
989	 go back to china . 	male
990	 i mean it s true girls just find something wrong in everything and make it all about them when it s not . how are we supposed to prove that we aren t the bad guys when they can never be satisfied ? feminism is stupid they should stop complaining . 	female
991	 i know what i just said sounds prejudiced but i m really not . 	male
992	 boys don t wear necklaces like that . 	female
993	 no fats no fems 	female
994	 everyone in afghanistan and iraq knows how to make road side bombs . they learn from their fathers and uncles . monkey see monkey do ! 	male
995	 native americans have to stop being so whiney . geronimo wasn t describing bin laden it s just a word . people have to stop being so sensitive and just get over it . 	male
996	 i shouldn t step outside in my turban people might think i m a terrorist . 	male
997	 name may be a person of color but name s not black . what right do name have to tell me about racism ? i mean name s mixed so name s half white ! 	male
998	 well she s puerto rican but she doesn t come off as latina . she comes off more like business name know ? 	female
999	 name s so much less man hating than i expected a women s college lesbian to be ! 	female
1000	 i don t think it would be fair to my other students if i let name have special treatment . 	male
1001	 i mean name s white name really have nothing to complain about . 	male
1002	 so are name gay or not ? name can t be pretty gay . at the end of the day bisexuals are usually actually homosexuals . 	male
1003	 come on name just need to meet the right guy to get name loosened up . 	female
1004	 marry someone with a name like smith so name can still have a weird first name but with a last name people can actually pronounce . it s better for name s kids that way too . 	female
1005	 the white interns complained that they were feeling left out . 	male
1006	 what do name mean name s a christian ? name s a lesbian ! that s just masochistic ! 	female
1007	 what are name ? 	male
1008	 name s dark that s the worst time to make a first impression . 	female
1009	 anyway the teacher says if name s not black or latin the standards are higher . i m so jealous of biracial girl she gets to put black but she still looks white . 	male
1010	 i m just not attracted to black or hispanic girls . 	female
1011	 there don t seem to be many american students there . 	male
1012	i feel like i should know this but what does the xs tag indicate ? intersectionality or . . . ? 	male
1013	 my friend kelly she s black but she s really smart . 	female
1014	 now which one of name is the real mom ? 	female
1015	 why do they keep talking about katrina ? it was five years ago ! 	male
1016	 i m allowed to use that word any way i want to ! i have a nephew like that and i grew up with cousins and classmates who were that way . 	male
1017	 name s so white . . . name s so not a black girl . i don t understand why name get upset when i say this . . . name don t act black . 	female
1018	 she s just trying to have her kobe bryant moment . 	female
1019	 well name have to understand that those people are from a different generation so name can t get upset . if they tell name that name s hair is festive it s not meant to be a bad thing name know ? 	female
1020	 i want to steal a black baby . black babies are just so much cuter than white babies ! 	male
1021	 ew name s hair looks like pubes ! 	female
1022	 this is totally an experience a lot of white kids can relate to . i once had a friend who wished she was indian loved the food dance culture everything ! then she went to china and wished she was chinese ! 	male
1023	 i don t think velma kelly can be played by a black girl . it just wouldn t seem right . 	female
1024	 i have news . . . the terrorist barack hussein obama has been hunted down and killed . . . girlish giggle oops i meant osama bin laden . 	male
1025	 name should be grateful . name may not get all that attention one day . lots of girls would trade places with name . 	female
1026	 what were name hit on the head too many times as a kid ? 	male
1027	 smile . 	male
1028	 i really don t like a graduate student speaker s fellow classmate he s so disgusting and fat . i hate fat people . they s so lazy . . . . no one should be fat not even poor people . . . poverty is no excuse . even in the ghetto name can walk on the street and work out . 	male
1029	 can i say that i have yellow fever ? 	female
1030	 name don t look jewish . 	male
1031	 yeah well name can bet he won t have to pay to go to good college . 	male
1032	 chinaman go home ! 	male
1033	 of course name like men . as a woman it s in name s nature . 	female
1034	 i m glad name changed name s hair . . . name were starting to look like buckwheat ! 	male
1035	 well what are aboriginals doing to preserve their culture ? they shouldn t be using computers then . 	male
1036	 so do name feel more straight now ? 	male
1037	 i m surprised name s not in jail right now . 	male
1038	 dude i m blacker than name . i watch comic view on bet every night . 	male
1039	i was just wondering how expensive and labor intensive is microaggressions to maintain . did name build it using all social media tools or did name customize it hiring developers or software engineers ? i would like to do something similar on a hyper local level around title ix violations in schools and would love to perhaps hire name as a consultant	male
1040	 are name chinese ? then what are name ? because name don t look like us . 	male
1041	 how come name don t have a chinese name like ling ling or something ? 	female
1042	 name s english is excellent . 	male
1043	 she s just being extra sensitive because her husband to be is not an english citizen . if he is a citizen he should not be offended . 	male
1044	 i keep getting freaked out whenever i look at name s hands it looks like they s attached to a woman . 	female
1045	 name ll fail . why don t name take keyboarding instead ? 	female
1046	 name s cousin is dating a new man . i don t know what he is but he s something . 	male
1047	 i just think life is hard enough without being gay on top of it . 	female
1048	 man outscored by a black guy . 	female
1049	 it s not fair that my son has to compete with illegal immigrants for college admissions . 	male
1050	 hey china doll ! ni hao ma ! 	female
1051	 we don t keep eating utensils in the car . that s what fat fat fat people do . 	male
1052	 the names black people come up with for their kids are just ridiculous . what s with all the prefixes ? te shawn and de andre . ridiculous . what s wrong with bob ? 	male
1053	 name should just get over it and get used to it sweetie . 	female
1054	 all name s friends are gay . i m worried that other people will make judgments about name and . . . lowers voice name should be careful because they might try to recruit name . 	male
1055	 if name were skinny name could just mooch off of some sucker who would pay for everything . 	female
1056	 well name do have a nice body . . . it s not really their fault . 	female
1057	 don t name want to get married someday ? 	female
1058	 i love my grandkids even though they are black . 	male
1059	 so ? 	female
1060	 ugh i hate living here . there s so many black people around . 	male
1061	 are name a boy or a girl ? sit up straight ! 	female
1062	 see when i think ghetto i think names like deshawn . . . name know ethnic sounding names . not allen . allen sounds like someone who makes money . 	male
1063	 we can t get him that . put it back it ll make him gay . 	male
1064	 name really shouldn t talk about that . nobody wants to hear about it . 	female
1065	 name s beautiful . oh name s married ? so do name have any sisters ? 	female
1066	 honey name probably aren t strong enough . 	female
1067	 she always wears such revealing clothing and flirts with all of these guys when we s out . it s just gross and dangerous . i m not saying that a person deserves to be raped but . . . 	female
1068	 not much of a man are name ? 	female
